{
  "schema_version": "trdgl_campaign_shard_index_v1",
  "evidence_label": "campaign",
  "benchmark_id": "trdgl_pytorch_120_v1",
  "shards": [
    {
      "generation_seed": 3407,
      "run_signature": "221b2ab2bb66e6110da76ea5cde39b20fb3613e8ee3527f8818a039e7b6d8475",
      "events_path": "../../benchmark_120/checkpoints/seed3407_480/events.checkpoint.jsonl",
      "run_manifest_path": "../../benchmark_120/checkpoints/seed3407_480/run_manifest.json",
      "executed_notebook_path": "../../benchmark_120/checkpoints/seed3407_480/executed_notebook.ipynb"
    }
  ]
}
